{
  "schema": "tspi-scenario/1",
  "name": "all-maneuvers",
  "seed": 7,
  "scene": {
    "origin_lla": { "lat_deg": 34.9061, "lon_deg": -117.8839, "alt_m": 700.0 },
    "epoch": "2026-07-11T17:00:00Z",
    "duration_s": 60.0,
    "dt_s": 0.02,
    "environment": { "atmosphere": "exp8500" }
  },
  "entities": [
    {
      "id": "demo-01",
      "team": "white",
      "type": "aircraft",
      "model": "generic-fighter",
      "initial": { "pos_ned_m": [0, 0, -5000], "vel_ned_mps": [200, 0, 0] },
      "maneuvers": [
        { "at_s": 2.0,  "speed":    { "kind": "set", "speed_mps": 280, "accel_mps2": 10 } },
        { "at_s": 10.0, "lateral":  { "kind": "turn_to_heading", "heading_deg": 90, "g_limit": 5 } },
        { "at_s": 20.0, "vertical": { "kind": "hold_alt", "alt_msl_m": 8000, "rate_mps": 50 } },
        { "at_s": 35.0, "lateral":  { "kind": "turn_to_heading", "heading_deg": 270, "g_limit": 6 },
                        "vertical": { "kind": "delta_alt", "delta_m": -1500, "rate_mps": 40 } }
      ]
    }
  ]
}
