{
  "schema": "tspi-scenario/1",
  "name": "minimal",
  "scene": {
    "origin_lla": { "lat_deg": 34.9061, "lon_deg": -117.8839, "alt_m": 700.0 },
    "duration_s": 20.0,
    "dt_s": 0.01
  },
  "entities": [
    {
      "id": "ship-01",
      "team": "blue",
      "type": "aircraft",
      "model": "generic-fighter",
      "initial": { "pos_ned_m": [0, 0, -6000], "vel_ned_mps": [220, 0, 0] }
    }
  ]
}
